<!--
-//NetBeans//DTD VCS Configuration 1.1//EN
http://www.netbeans.org/dtds/vcs-configuration-1_1.dtd
XML representation of a VCS commands and variables configuration profile
-->
<!--
                Sun Public License Notice

The contents of this file are subject to the Sun Public License
Version 1.0 (the "License"). You may not use this file except in
compliance with the License. A copy of the License is available at
http://www.sun.com/

The Original Code is NetBeans. The Initial Developer of the Original
Code is Sun Microsystems, Inc. Portions Copyright 1997-2003 Sun
Microsystems, Inc. All Rights Reserved.
-->

<!ELEMENT configuration    (label, os?, (condition)*, variables, commands, globalCommands?)   >
<!ELEMENT label            (#PCDATA)   >
<!ELEMENT os               (compatible?, uncompatible?)   >
<!ELEMENT compatible       (#PCDATA)   >
<!ELEMENT uncompatible     (#PCDATA)   >
<!ELEMENT condition        (var|and|or|not)*   >
<!ELEMENT var              EMPTY   >
<!ELEMENT and              (var|and|or|not)*   >
<!ELEMENT or               (var|and|or|not)*   >
<!ELEMENT not              (var)   >
<!ELEMENT variables        (variable)*   >
<!ELEMENT commands         (command|separator)*   >
<!ELEMENT globalCommands   (command)*   >
<!ELEMENT variable         (value)*   >
<!ELEMENT command          (command|separator|property)*   >
<!ELEMENT separator        EMPTY   >
<!ELEMENT property         (value)*   >
<!ELEMENT value            (#PCDATA)   >

<!ATTLIST condition
          var              CDATA #REQUIRED   >

<!ATTLIST var
          name             CDATA #REQUIRED
          value            CDATA #IMPLIED
          valueIgnoreCase  CDATA #IMPLIED
          valueContains    CDATA #IMPLIED
          valueContainsIgnoreCase  CDATA #IMPLIED   >

<!ATTLIST variable
          name             CDATA #REQUIRED
          basic            CDATA #IMPLIED
          label            CDATA #IMPLIED
          labelMnemonic    CDATA #IMPLIED
          localFile        CDATA #IMPLIED
          localDir         CDATA #IMPLIED
          executable       CDATA #IMPLIED
          order            CDATA #IMPLIED
          selector         CDATA #IMPLIED
          if               CDATA #IMPLIED
          unless           CDATA #IMPLIED   >

<!ATTLIST command
          name             CDATA #REQUIRED
          displayName      CDATA #IMPLIED                                                                                    
          if               CDATA #IMPLIED
          unless           CDATA #IMPLIED     >

<!ATTLIST property
          name             CDATA #REQUIRED
          if               CDATA #IMPLIED
          unless           CDATA #IMPLIED    >

<!ATTLIST value
          xml:space        CDATA #IMPLIED
          if               CDATA #IMPLIED
          unless           CDATA #IMPLIED    >

